{
  "schema": "vox_mens_scorecard_summary_v1",
  "schema_version": 1,
  "prompt_pack_version": "vox-mens-v1",
  "git_sha": "abc123",
  "run_started_utc": "2026-03-27T12:00:00Z",
  "spec_path": "contracts/eval/mens-scorecard.baseline.json",
  "kpi_contract_alignment": {
    "runtime_generation_kpi_schema": "vox_runtime_generation_kpi_v1",
    "mens_scorecard_event_schema_id": "https://voxlang.org/schemas/eval/mens-scorecard-event.schema.json"
  },
  "conditions": [
    {
      "id": "best_qlora_fixture",
      "label": "Current best QLoRA fixture outputs",
      "backend": "qlora",
      "model_id": "Qwen/Qwen3.5-4B+adapter",
      "adapter_revision": "manual",
      "total_tasks": 2,
      "compile_pass_at_1": 0.9,
      "compile_pass_at_n": 1.0,
      "canonical_pass": 1.0,
      "voxelized_strictness": 1.0,
      "task_success": 1.0,
      "semantic_task_success": 1.0,
      "repair_depth_mean": 0.1,
      "repair_stall_rate": 0.0,
      "time_to_first_valid_p50_ms": 60,
      "latency_p50_ms": 70,
      "latency_p95_ms": 140,
      "tokens_in_total": 40,
      "tokens_out_total": 60,
      "placeholder_hits_total": 0,
      "placeholder_event_rate": 0.0,
      "trivial_placeholder_rate": 0.0,
      "construct_richness_mean": 0.45,
      "anti_stub_pass_rate": 1.0
    }
  ]
}
